{"id":"metrics.scene.playable.raid.machine_silo","scene_id":"scene.playable.raid.machine_silo","display_name":"Playable Machine Silo Raid","traversal_time_seconds":"540","cover_density_label":"medium","landmark_quality_label":"strong","companion_path_safety_label":"medium_high","extraction_readability_label":"clear","review_record_id":"review.playable_space.scene.playable.raid.machine_silo"}
