{"id":"metrics.scene.playable.home_base","scene_id":"scene.playable.home_base","display_name":"Playable Home Base","traversal_time_seconds":"45","cover_density_label":"low","landmark_quality_label":"strong","companion_path_safety_label":"high","extraction_readability_label":"n/a","review_record_id":"review.playable_space.scene.playable.home_base"}
